	Hotel Name	Price	Amenities	Reviews	Photos
21	The Leela Ambience Convention Hotel, Delhi	₹5,915	, Free parking, Free internet, Pool, Fitness Center with Gym / Workout Room, Free breakfast, Kids stay free, Babysitting, Airport transportation, Valet parking, Wifi, Paid wifi, Hot tub, Pool / beach towels, Outdoor pool, Fitness / spa locker rooms, Sauna, Bar / lounge, Coffee shop, Restaurant, Breakfast available, Breakfast buffet, Car hire, Taxi service, Business Center with Internet Access, Conference facilities, Banquet room, Meeting rooms, Fax / photocopying, Spa, Salon, Steam room, 24-hour security, Baggage storage, Concierge, Currency exchange, Newspaper, ATM on site, Butler service, Doorperson, 24-hour check-in, 24-hour front desk, Express check-in / check-out, Private check-in / check-out, Dry cleaning, Laundry service, Ironing service, Shoeshine, Blackout curtains, Soundproof rooms, Air conditioning, Housekeeping, Room service, Safe, Minibar, Flatscreen TV, VIP room facilities, Refrigerator, Non-smoking rooms, Suites, Family rooms, Smoking rooms available	5.0	https://dynamic-media-cdn.tripadvisor.com/media/photo-o/13/96/a1/5c/the-leela-ambience-convention.jpg?w=900&h=-1&s=1
22	Taurus Sarovar Portico	₹1,667	, Free parking, Free High Speed Internet (WiFi), Coffee shop, Car hire, Business Center with Internet Access, Conference facilities, 24-hour security, Baggage storage, Valet parking, Wifi, Restaurant, Breakfast available, Breakfast buffet, Taxi service, Banquet room, Meeting rooms, Concierge, Currency exchange, Non-smoking hotel, Doorperson, 24-hour check-in, 24-hour front desk, Express check-in / check-out, Dry cleaning, Laundry service, Ironing service, Air conditioning, Dining area, Housekeeping, Interconnected rooms available, Coffee / tea maker, Refrigerator, Cable / satellite TV, Bath / shower, Room service, Safe, Seating area, Separate dining area, Separate living room, Sofa, Telephone, Bottled water, Clothes rack, Iron, Private bathrooms, Wake-up service / alarm clock, Flatscreen TV, Complimentary toiletries, Hair dryer, City view, Non-smoking rooms, Suites, Family rooms	4.0	https://dynamic-media-cdn.tripadvisor.com/media/photo-o/12/9d/a3/85/taurus-sarovar-portico.jpg?w=900&h=-1&s=1
23	WelcomHotel Dwarka	NA	, Free parking, Wifi, Pool, Fitness Center with Gym / Workout Room, Bar / lounge, Kids stay free, Babysitting, Airport transportation, Valet parking, Paid wifi, Outdoor pool, Fitness / spa locker rooms, Restaurant, Breakfast available, Breakfast buffet, Car hire, Taxi service, Conference facilities, Banquet room, Massage, 24-hour security, Baggage storage, Concierge, Currency exchange, Shops, Butler service, Doorperson, 24-hour check-in, 24-hour front desk, Dry cleaning, Laundry service, Ironing service, Shoeshine, Housekeeping, Room service, Safe, VIP room facilities, Flatscreen TV, Non-smoking rooms, Suites	4.5	https://dynamic-media-cdn.tripadvisor.com/media/photo-o/04/72/65/68/welcomhotel-dwarka-new.jpg?w=900&h=-1&s=1
24	Park Inn By Radisson New Delhi IP Extension	₹5,700	, Free parking, Free High Speed Internet (WiFi), Pool, Fitness Center with Gym / Workout Room, Free breakfast, Airport transportation, Business Center with Internet Access, Conference facilities, Parking, Wifi, Rooftop pool, Outdoor pool, Restaurant, Swimup bar, Breakfast available, Breakfast buffet, Rooftop bar, Banquet room, Meeting rooms, Rooftop terrace, Concierge, Currency exchange, Doorperson, Dry cleaning, Laundry service, Air conditioning, Housekeeping, Interconnected rooms available, Room service, Minibar, Electric kettle, Cable / satellite TV, Bath / shower, Telephone, Wardrobe / closet, Bottled water, Flatscreen TV, Complimentary toiletries, Hair dryer, Non-smoking rooms, Smoking rooms available	4.0	https://dynamic-media-cdn.tripadvisor.com/media/photo-o/19/6a/58/83/hotel-exterior.jpg?w=900&h=-1&s=1
25	Park Plaza Delhi CBD Shahdara	₹3,600	, Free parking, Free High Speed Internet (WiFi), Pool, Fitness Center with Gym / Workout Room, Bar / lounge, Kids stay free, Children Activities (Kid / Family Friendly), Airport transportation, Parking, Wifi, Rooftop pool, Indoor pool, Outdoor pool, Restaurant, Breakfast buffet, Swimup bar, Business Center with Internet Access, Conference facilities, Banquet room, Meeting rooms, Spa, Massage, Salon, Steam room, Rooftop terrace, Baggage storage, Concierge, Butler service, Doorperson, 24-hour check-in, Dry cleaning, Laundry service, Ironing service, Air conditioning, Housekeeping, Room service, Safe, Minibar, Flatscreen TV, Non-smoking rooms, Suites, Family rooms, Smoking rooms available	4.5	https://dynamic-media-cdn.tripadvisor.com/media/photo-o/19/69/c7/6c/exterior-with-porch.jpg?w=900&h=-1&s=1
26	Park Inn by Radisson New Delhi Lajpat Nagar	₹3,080	, Free parking, Free High Speed Internet (WiFi), Fitness Center with Gym / Workout Room, Free breakfast, Children Activities (Kid / Family Friendly), Airport transportation, Business Center with Internet Access, Conference facilities, Valet parking, Wifi, Bar / lounge, Coffee shop, Restaurant, Breakfast available, Breakfast buffet, Special diet menus, Car hire, Taxi service, Banquet room, Meeting rooms, Fax / photocopying, 24-hour security, Baggage storage, Concierge, Currency exchange, Newspaper, Non-smoking hotel, Doorperson, 24-hour front desk, Express check-in / check-out, Dry cleaning, Laundry service, Ironing service, Shoeshine, Air conditioning, Desk, Housekeeping, Room service, Minibar, Flatscreen TV, Bath / shower, Complimentary toiletries, Safe, Telephone, Bottled water, Iron, Wake-up service / alarm clock, Hair dryer, Non-smoking rooms, Suites, Family rooms, Smoking rooms available	4.0	https://dynamic-media-cdn.tripadvisor.com/media/photo-o/19/78/49/20/hotel-exterior.jpg?w=900&h=-1&s=1
27	Holiday Inn Express New Delhi International Airport T3	₹8,500	, Free High Speed Internet (WiFi), Fitness Center with Gym / Workout Room, Coffee shop, Pets Allowed ( Dog / Pet Friendly ), Fax / photocopying, Foot massage, 24-hour security, Baggage storage, Wifi, Restaurant, Breakfast available, Breakfast buffet, Full body massage, Hand massage, Head massage, Massage, Neck massage, Currency exchange, Newspaper, Non-smoking hotel, 24-hour front desk, Shoeshine, Soundproof rooms, Air conditioning, Housekeeping, Safe, Bottled water, Refrigerator, Flatscreen TV, Non-smoking rooms	3.5	https://dynamic-media-cdn.tripadvisor.com/media/photo-o/0c/dd/84/78/guest-room--v12572332.jpg?w=900&h=-1&s=1
28	Radisson Blu Marina Connaught Place	₹3,999	, Parking, Free High Speed Internet (WiFi), Fitness Center with Gym / Workout Room, Free breakfast, Airport transportation, Business Center with Internet Access, Conference facilities, Spa, Wifi, Bar / lounge, Restaurant, Breakfast buffet, Car hire, Taxi service, Banquet room, Meeting rooms, 24-hour security, Concierge, Newspaper, Doorperson, Dry cleaning, Laundry service, Ironing service, Shoeshine, Air conditioning, Housekeeping, Room service, Safe, VIP room facilities, Minibar, Flatscreen TV, Non-smoking rooms, Suites	3.5	https://dynamic-media-cdn.tripadvisor.com/media/photo-o/1a/47/a0/87/facade.jpg?w=900&h=-1&s=1
29	Hotel LA	₹4,409	, Free parking, Free High Speed Internet (WiFi), Pool, Sauna, Bar / lounge, Children Activities (Kid / Family Friendly), Business Center with Internet Access, Conference facilities, Valet parking, Wifi, Pool / beach towels, Infinity pool, Rooftop pool, Pool with view, Indoor pool, Coffee shop, Restaurant, Breakfast available, Breakfast buffet, Breakfast in the room, Banquet room, Meeting rooms, Fax / photocopying, Spa, 24-hour security, Non-smoking hotel, 24-hour front desk, Dry cleaning, Laundry service, Shoeshine, Blackout curtains, Bathrobes, Air conditioning, Desk, Housekeeping, Coffee / tea maker, Cable / satellite TV, Bath / shower, Private balcony, Room service, Safe, Seating area, Sofa, Telephone, Wardrobe / closet, Bottled water, Laptop safe, Private bathrooms, Minibar, Flatscreen TV, Complimentary toiletries, Hair dryer, City view, Bridal suite, Non-smoking rooms, Suites, Family rooms, Smoking rooms available	4.5	https://dynamic-media-cdn.tripadvisor.com/media/photo-o/17/fd/cf/39/hotel-la.jpg?w=900&h=-1&s=1
